{
  "$schema": "../../schemas/dictionary.schema.json",
  "name": "pnpm",
  "summary": { "ja": "ディスク効率のよい Node.js のパッケージ管理ツールです", "en": "Fast, disk-efficient package manager for Node.js" },
  "description": { "ja": "npm と同じ package.json を使いますが、依存を共有ストアに一度だけ保存するので速くて軽いです。ロックファイルは pnpm-lock.yaml です。", "en": "Uses the same package.json as npm but stores each dependency once in a shared store, so it is fast and light. The lockfile is pnpm-lock.yaml." },
  "install": { "npm": "npm install -g pnpm", "winget": "winget install pnpm.pnpm", "scoop": "scoop install pnpm", "brew": "brew install pnpm", "url": "https://pnpm.io/installation" },
  "subcommands": [
    {
      "name": "install",
      "aliases": ["i"],
      "summary": { "ja": "package.json の依存をすべてインストールします", "en": "Installs all dependencies from package.json" },
      "options": [
        { "flags": ["--frozen-lockfile"], "summary": { "ja": "pnpm-lock.yaml を変更せずにインストール（CI 向け）", "en": "Install without changing pnpm-lock.yaml (for CI)" } },
        { "flags": ["-P", "--prod"], "summary": { "ja": "devDependencies を入れない", "en": "Skip devDependencies" } }
      ],
      "errors": [
        { "pattern": "ERR_PNPM_OUTDATED_LOCKFILE", "hint": { "ja": "ロックファイルが package.json と合っていません。--frozen-lockfile なしで実行して更新してください", "en": "The lockfile is out of sync with package.json. Run without --frozen-lockfile to update it" }, "fix": "pnpm install --no-frozen-lockfile" },
        { "pattern": "ERR_PNPM_PEER_DEP_ISSUES", "hint": { "ja": "peer 依存の不一致です。多くは警告だけで動きます。必要なら .npmrc に strict-peer-dependencies=false を書きます", "en": "Peer dependency mismatch. Usually safe to continue; set strict-peer-dependencies=false in .npmrc if needed" } },
        { "pattern": "ERR_PNPM_NO_PKG_MANIFEST", "hint": { "ja": "このフォルダに package.json がありません。プロジェクトのフォルダへ移動するか pnpm init で作れます", "en": "No package.json here. Move to the project folder or create one with pnpm init" }, "fix": "pnpm init" }
      ]
    },
    {
      "name": "add",
      "summary": { "ja": "パッケージを追加してインストールします", "en": "Adds and installs a package" },
      "args": [{ "name": "package", "type": "package", "variadic": true }],
      "options": [
        { "flags": ["-D", "--save-dev"], "summary": { "ja": "開発時だけ使う依存として追加", "en": "Add as a dev dependency" } },
        { "flags": ["-g", "--global"], "summary": { "ja": "PC 全体にインストール", "en": "Install globally" }, "danger": "warn", "dangerMessage": { "ja": "PC 全体に入ります。プロジェクトの依存にはなりません", "en": "Installs machine-wide, not as a project dependency" } },
        { "flags": ["-w", "--workspace-root"], "summary": { "ja": "ワークスペースのルートに追加", "en": "Add to the workspace root" } }
      ],
      "examples": [{ "command": "pnpm add -D typescript", "summary": { "ja": "TypeScript を開発依存として追加", "en": "Add TypeScript as a dev dependency" } }],
      "errors": [
        { "pattern": "ERR_PNPM_FETCH_404.*/(?<pkg>[^/\\s]+)", "hint": { "ja": "{pkg} がレジストリに見つかりません。名前のスペルを確認してください", "en": "{pkg} was not found in the registry. Check the spelling" } },
        { "pattern": "ERR_PNPM_ADDING_TO_ROOT", "hint": { "ja": "ワークスペースのルートに追加するには -w を付けます", "en": "Adding to the workspace root needs -w" }, "fix": "pnpm add -w {args}" }
      ]
    },
    {
      "name": "remove",
      "aliases": ["rm", "uninstall", "un"],
      "summary": { "ja": "パッケージを削除します", "en": "Removes a package" },
      "args": [{ "name": "package", "type": "package", "variadic": true }]
    },
    {
      "name": "run",
      "summary": { "ja": "package.json の scripts を実行します", "en": "Runs a script from package.json" },
      "args": [{ "name": "script", "type": "string" }],
      "options": [{ "flags": ["-r", "--recursive"], "summary": { "ja": "ワークスペースの全パッケージで実行", "en": "Run in every workspace package" } }],
      "errors": [{ "pattern": "ERR_PNPM_NO_SCRIPT.*\"(?<name>[^\"]+)\"", "hint": { "ja": "scripts に {name} がありません。pnpm run で一覧を見られます", "en": "No script named {name}. Run pnpm run to list them" }, "fix": "pnpm run" }]
    },
    {
      "name": "dlx",
      "summary": { "ja": "パッケージをインストールせず一時的に実行します（npx 相当）", "en": "Runs a package without installing it (like npx)" },
      "args": [{ "name": "package", "type": "package" }],
      "examples": [{ "command": "pnpm dlx create-vite my-app", "summary": { "ja": "Vite のプロジェクトを作る", "en": "Scaffold a Vite project" } }]
    },
    {
      "name": "update",
      "aliases": ["up", "upgrade"],
      "summary": { "ja": "依存を範囲内で更新します", "en": "Updates dependencies within their ranges" },
      "options": [
        { "flags": ["-L", "--latest"], "summary": { "ja": "範囲を無視して最新に", "en": "Ignore ranges and go to latest" }, "danger": "warn", "dangerMessage": { "ja": "メジャーバージョンが上がり、動かなくなることがあります", "en": "May bump major versions and break things" } },
        { "flags": ["-i", "--interactive"], "summary": { "ja": "更新するものを選ぶ", "en": "Pick what to update" } }
      ]
    },
    { "name": "init", "summary": { "ja": "新しい package.json を作ります", "en": "Creates a new package.json" } },
    {
      "name": "exec",
      "summary": { "ja": "インストール済みのコマンドを実行します", "en": "Runs a command from installed packages" },
      "args": [{ "name": "command", "type": "command" }]
    },
    {
      "name": "store",
      "summary": { "ja": "共有ストアを管理します", "en": "Manages the shared store" },
      "options": [
        { "flags": ["prune"], "summary": { "ja": "どこからも使われていないパッケージをストアから削除", "en": "Remove unreferenced packages from the store" } },
        { "flags": ["path"], "summary": { "ja": "ストアの場所を表示", "en": "Show the store path" } }
      ]
    },
    { "name": "publish", "summary": { "ja": "パッケージを npm レジストリに公開します", "en": "Publishes the package to the npm registry" }, "danger": "confirm", "dangerMessage": { "ja": "公開すると取り消しが難しくなります。バージョンと中身を確認してください", "en": "Publishing is hard to undo. Check the version and contents" } }
  ],
  "errors": [
    { "pattern": "'pnpm' is not recognized|pnpm: command not found", "hint": { "ja": "pnpm が入っていません。Node.js 付属の corepack enable で有効にできます", "en": "pnpm is not installed. corepack enable (bundled with Node.js) turns it on" }, "fix": "corepack enable pnpm" },
    { "pattern": "ERR_PNPM_META_FETCH_FAIL|ENOTFOUND|ETIMEDOUT", "hint": { "ja": "レジストリに接続できません。ネットワークやプロキシを確認してください", "en": "Cannot reach the registry. Check your network or proxy" } },
    { "pattern": "ERR_PNPM_UNEXPECTED_STORE", "hint": { "ja": "ストアの場所が変わりました。node_modules を作り直すと直ります", "en": "The store location changed. Reinstalling node_modules fixes it" }, "fix": "rm -rf node_modules && pnpm install" },
    { "pattern": "EPERM.*operation not permitted", "hint": { "ja": "ファイルがロックされています。エディタや開発サーバーを閉じてから再実行してください", "en": "A file is locked. Close editors or dev servers and retry" } }
  ]
}
